<?xml version="1.0" encoding="UTF-8"?>
<z:Zahtevi xmlns:vc="http://www.w3.org/2007/XMLSchema-versioning"
           xmlns:z="www.zavod.com/Zig"
           xmlns:xsi="http://www.w3.org/2001/XMLSchema-instance"
           xsi:schemaLocation="www.zavod.com/Zig file:/home/pavle/Documents/XML/Projekat/z1.xsd">
    <z:Zahtev>
        <z:Podnosilac xsi:type="z:TPravno_Lice">
            <z:adresa>
                <z:ulica>ulica0</z:ulica>
                <z:broj>broj0</z:broj>
                <z:mesto>mesto0</z:mesto>
                <z:drzava>drzava0</z:drzava>
                <z:postanski_broj>22000</z:postanski_broj>
            </z:adresa>
            <z:telefon>
            </z:telefon>
            <z:email>
            </z:email>
            <z:faks>
            </z:faks>
            <z:poslovno_ime>
            </z:poslovno_ime>
        </z:Podnosilac>
        <z:Punomocnik xsi:type="z:TPravno_Lice">
            <z:adresa>
                <z:ulica>ulica1</z:ulica>
                <z:broj>broj1</z:broj>
                <z:mesto>mesto1</z:mesto>
                <z:drzava>drzava1</z:drzava>
                <z:postanski_broj>22000</z:postanski_broj>
            </z:adresa>
            <z:telefon>
            </z:telefon>
            <z:email>
            </z:email>
            <z:faks>
            </z:faks>
            <z:poslovno_ime>
            </z:poslovno_ime>
        </z:Punomocnik>
        <z:Predstavnik xsi:type="z:TPravno_Lice">
            <z:adresa>
                <z:ulica>ulica2</z:ulica>
                <z:broj>broj2</z:broj>
                <z:mesto>mesto2</z:mesto>
                <z:drzava>drzava2</z:drzava>
                <z:postanski_broj>22000</z:postanski_broj>
            </z:adresa>
            <z:telefon>
            </z:telefon>
            <z:email>
            </z:email>
            <z:faks>
            </z:faks>
            <z:poslovno_ime>
            </z:poslovno_ime>
        </z:Predstavnik>
        <z:Zig>
            <z:tip_ziga>
                <z:kolektivni>
                </z:kolektivni>
            </z:tip_ziga>
            <z:tip_znaka>
                <z:druga_vrsta>
                </z:druga_vrsta>
            </z:tip_znaka>
            <z:boja>boja0</z:boja>
            <z:transliteracija>transliteracija0</z:transliteracija>
            <z:prevod>prevod0</z:prevod>
            <z:opis>opis0</z:opis>
            <z:klase_robe>
                <z:klasa>23</z:klasa>
            </z:klase_robe>
            <z:pravo_prvenstva>pravo_prvenstva0</z:pravo_prvenstva>
        </z:Zig>
        <z:Placanje>
            <z:osnovna_taksa>0</z:osnovna_taksa>
            <z:taksa_klasa>0</z:taksa_klasa>
            <z:taksa_grafickog_resenja>0</z:taksa_grafickog_resenja>
            <z:ukupna>0</z:ukupna>
        </z:Placanje>
        <z:InformacijeZavoda/>
    </z:Zahtev>
</z:Zahtevi>
